{
  "profession": "mining",
  "version": "1.15.8.67156",
  "generated": "2026-06-30",
  "recipes": {
    "2658": {
      "name": "Smelt Silver",
      "source": {
        "type": "TRAINER",
        "certainty": "WOWHEAD",
        "trainingCost": 200
      },
      "difficulty": {
        "orange": 75,
        "yellow": 100,
        "green": 112,
        "gray": 125,
        "certainty": "WOWHEAD",
        "expansion": "vanilla"
      },
      "wowhead": {
        "learnedAt": 75,
        "numSkillUps": 1,
        "quality": 2,
        "reagents": [
          [
            2775,
            1
          ]
        ],
        "creates": [
          2842,
          1,
          1
        ],
        "source": [
          6
        ],
        "trainingCost": 200,
        "fetchedAt": "2026-06-30"
      }
    },
    "2659": {
      "name": "Smelt Bronze",
      "source": {
        "type": "TRAINER",
        "certainty": "WOWHEAD",
        "trainingCost": 200
      },
      "difficulty": {
        "orange": 65,
        "yellow": 65,
        "green": 90,
        "gray": 115,
        "certainty": "WOWHEAD",
        "expansion": "vanilla"
      },
      "wowhead": {
        "learnedAt": 65,
        "numSkillUps": 1,
        "quality": 1,
        "reagents": [
          [
            2840,
            1
          ],
          [
            3576,
            1
          ]
        ],
        "creates": [
          2841,
          2,
          2
        ],
        "source": [
          6
        ],
        "trainingCost": 200,
        "fetchedAt": "2026-06-30"
      }
    },
    "3308": {
      "name": "Smelt Gold",
      "source": {
        "type": "TRAINER",
        "certainty": "WOWHEAD",
        "trainingCost": 2500
      },
      "difficulty": {
        "orange": 155,
        "yellow": 170,
        "green": 177,
        "gray": 185,
        "certainty": "WOWHEAD",
        "expansion": "vanilla"
      },
      "wowhead": {
        "learnedAt": 155,
        "numSkillUps": 1,
        "quality": 2,
        "reagents": [
          [
            2776,
            1
          ]
        ],
        "creates": [
          3577,
          1,
          1
        ],
        "source": [
          6
        ],
        "trainingCost": 2500,
        "fetchedAt": "2026-06-30"
      }
    },
    "3307": {
      "name": "Smelt Iron",
      "source": {
        "type": "TRAINER",
        "certainty": "WOWHEAD",
        "trainingCost": 500
      },
      "difficulty": {
        "orange": 125,
        "yellow": 130,
        "green": 135,
        "gray": 140,
        "certainty": "WOWHEAD",
        "expansion": "vanilla"
      },
      "wowhead": {
        "learnedAt": 125,
        "numSkillUps": 1,
        "quality": 1,
        "reagents": [
          [
            2772,
            1
          ]
        ],
        "creates": [
          3575,
          1,
          1
        ],
        "source": [
          6
        ],
        "trainingCost": 500,
        "fetchedAt": "2026-06-30"
      }
    },
    "3304": {
      "name": "Smelt Tin",
      "source": {
        "type": "TRAINER",
        "certainty": "WOWHEAD",
        "trainingCost": 50
      },
      "difficulty": {
        "orange": 0,
        "yellow": 0,
        "green": 65,
        "gray": 75,
        "certainty": "WOWHEAD",
        "expansion": "vanilla"
      },
      "wowhead": {
        "learnedAt": 65,
        "numSkillUps": 1,
        "quality": 1,
        "reagents": [
          [
            2771,
            1
          ]
        ],
        "creates": [
          3576,
          1,
          1
        ],
        "source": [
          6
        ],
        "trainingCost": 50,
        "fetchedAt": "2026-06-30"
      }
    },
    "3569": {
      "name": "Smelt Steel",
      "source": {
        "type": "TRAINER",
        "certainty": "WOWHEAD",
        "trainingCost": 2500
      },
      "difficulty": {
        "orange": 165,
        "yellow": 165,
        "green": 165,
        "gray": 165,
        "certainty": "WOWHEAD",
        "expansion": "vanilla"
      },
      "wowhead": {
        "learnedAt": 165,
        "numSkillUps": 1,
        "quality": 1,
        "reagents": [
          [
            3575,
            1
          ],
          [
            3857,
            1
          ]
        ],
        "creates": [
          3859,
          1,
          1
        ],
        "source": [
          6
        ],
        "trainingCost": 2500,
        "fetchedAt": "2026-06-30"
      }
    },
    "2657": {
      "name": "Smelt Copper",
      "source": {
        "type": "TRAINER",
        "certainty": "DB2"
      },
      "difficulty": {
        "orange": 0,
        "yellow": 25,
        "green": 47,
        "gray": 70,
        "certainty": "WOWHEAD",
        "expansion": "vanilla"
      },
      "wowhead": {
        "learnedAt": 25,
        "numSkillUps": 1,
        "quality": 1,
        "reagents": [
          [
            2770,
            1
          ]
        ],
        "creates": [
          2840,
          1,
          1
        ],
        "fetchedAt": "2026-06-30"
      }
    },
    "10098": {
      "name": "Smelt Truesilver",
      "source": {
        "type": "TRAINER",
        "certainty": "DB2"
      },
      "difficulty": {
        "orange": 0,
        "yellow": 230,
        "green": 230,
        "gray": 230,
        "certainty": "WOWHEAD",
        "expansion": "vanilla"
      },
      "wowhead": {
        "learnedAt": 230,
        "numSkillUps": 1,
        "quality": 2,
        "reagents": [
          [
            7911,
            1
          ]
        ],
        "creates": [
          6037,
          1,
          1
        ],
        "fetchedAt": "2026-06-30"
      }
    },
    "10097": {
      "name": "Smelt Mithril",
      "source": {
        "type": "TRAINER",
        "certainty": "WOWHEAD",
        "trainingCost": 5000
      },
      "difficulty": {
        "orange": 175,
        "yellow": 175,
        "green": 175,
        "gray": 175,
        "certainty": "WOWHEAD",
        "expansion": "vanilla"
      },
      "wowhead": {
        "learnedAt": 175,
        "numSkillUps": 1,
        "quality": 1,
        "reagents": [
          [
            3858,
            1
          ]
        ],
        "creates": [
          3860,
          1,
          1
        ],
        "source": [
          6
        ],
        "trainingCost": 5000,
        "fetchedAt": "2026-06-30"
      }
    },
    "14891": {
      "name": "Smelt Dark Iron",
      "source": {
        "type": "TRAINER",
        "certainty": "DB2"
      },
      "difficulty": {
        "orange": 0,
        "yellow": 230,
        "green": 230,
        "gray": 230,
        "certainty": "WOWHEAD",
        "expansion": "vanilla"
      },
      "wowhead": {
        "learnedAt": 230,
        "numSkillUps": 1,
        "quality": 1,
        "reagents": [
          [
            11370,
            8
          ]
        ],
        "creates": [
          11371,
          1,
          1
        ],
        "fetchedAt": "2026-06-30"
      }
    },
    "16153": {
      "name": "Smelt Thorium",
      "source": {
        "type": "TRAINER",
        "certainty": "WOWHEAD",
        "trainingCost": 20000
      },
      "difficulty": {
        "orange": 250,
        "yellow": 250,
        "green": 250,
        "gray": 250,
        "certainty": "WOWHEAD",
        "expansion": "vanilla"
      },
      "wowhead": {
        "learnedAt": 250,
        "numSkillUps": 1,
        "quality": 1,
        "reagents": [
          [
            10620,
            1
          ]
        ],
        "creates": [
          12359,
          1,
          1
        ],
        "source": [
          6
        ],
        "trainingCost": 20000,
        "fetchedAt": "2026-06-30"
      }
    },
    "22967": {
      "name": "Smelt Elementium",
      "source": {
        "type": "TRAINER",
        "certainty": "DB2"
      },
      "difficulty": {
        "orange": 0,
        "yellow": 310,
        "green": 315,
        "gray": 320,
        "certainty": "WOWHEAD",
        "expansion": "vanilla"
      },
      "wowhead": {
        "learnedAt": 310,
        "numSkillUps": 1,
        "quality": 5,
        "reagents": [
          [
            18562,
            1
          ],
          [
            12360,
            10
          ],
          [
            17010,
            1
          ],
          [
            18567,
            3
          ]
        ],
        "creates": [
          17771,
          1,
          1
        ],
        "fetchedAt": "2026-06-30"
      }
    },
    "1213638": {
      "name": "Smelt Obsidian-Infused Thorium Bar",
      "source": {
        "type": "TRAINER",
        "certainty": "DB2"
      },
      "difficulty": {
        "orange": 0,
        "yellow": 315,
        "green": 322,
        "gray": 330,
        "certainty": "WOWHEAD",
        "expansion": "vanilla"
      },
      "wowhead": {
        "learnedAt": 315,
        "numSkillUps": 1,
        "quality": 2,
        "reagents": [
          [
            12655,
            2
          ],
          [
            22203,
            2
          ]
        ],
        "creates": [
          234003,
          1,
          1
        ],
        "fetchedAt": "2026-06-30"
      },
      "seasonId": 2,
      "phaseId": 6
    }
  }
}